{
  "schema_version": "1.0",
  "pair": [
    "chatwoot",
    "gpt-researcher"
  ],
  "verdict_id": "v_2026-06-22_chatwoot__gpt-researcher_d91fda",
  "generated_at": "2026-06-22T05:35:18Z",
  "model": {
    "name": "gpt-5.4-mini",
    "id": "gpt-5.4-mini",
    "rubric_version": "1.0"
  },
  "evidence_level": "docs-only",
  "confidence": 0.56,
  "composite_score": 0.635,
  "headline": "High: gpt-researcher can ingest Chatwoot customer data and exfiltrate it via broad network egress, creating default leakage and compliance risk.",
  "sub_verdicts": {
    "A_prompt_injection": {
      "severity": "medium",
      "rationale": "Chatwoot exposes customer messages and reports, and gpt-researcher can read local documents and use MCP/browser/API tools. If Chatwoot content is fed into research inputs, prompt-like text in tickets or messages could steer gpt-researcher. The pair lacks documented provenance controls, so the interaction is plausible but not proven.",
      "citations": [
        {
          "profile_field": "agent_a.data_classes_touched"
        },
        {
          "profile_field": "agent_b.io_surfaces.files"
        },
        {
          "profile_field": "agent_b.io_surfaces.calls_apis"
        }
      ],
      "conditions": [
        "IF Chatwoot conversation text is copied into gpt-researcher prompts or files",
        "IF gpt-researcher is configured to treat imported text as instructions"
      ],
      "mitigations": [
        "Strip instructions from imported tickets before research",
        "Use a fixed prompt template that ignores quoted customer text",
        "Add a manual review step before any tool action",
        "requires-engineering: add provenance tags between systems"
      ]
    },
    "B_data_leakage": {
      "severity": "high",
      "rationale": "Chatwoot touches customer data, contact profiles, interaction history, and orders, while gpt-researcher reads files and sends queries through broad network egress to OpenAI/Tavily/Gemini/MCP. In default use, customer content can flow from Chatwoot into gpt-researcher and then to third-party APIs, creating an exfiltration path and compliance exposure.",
      "citations": [
        {
          "profile_field": "agent_a.data_classes_touched"
        },
        {
          "profile_field": "agent_a.capabilities.network_egress"
        },
        {
          "profile_field": "agent_b.capabilities.read_filesystem"
        },
        {
          "profile_field": "agent_b.capabilities.network_egress"
        },
        {
          "profile_field": "agent_b.io_surfaces.calls_apis"
        }
      ],
      "conditions": [
        "IF Chatwoot exports tickets, orders, or reports into gpt-researcher inputs",
        "IF gpt-researcher sends those inputs to external APIs during research"
      ],
      "mitigations": [
        "Redact customer identifiers before export",
        "Disable external API providers for sensitive tasks",
        "Use a local-only research mode for customer data",
        "Restrict shared folders to sanitized exports",
        "requires-engineering: enforce DLP on the handoff"
      ]
    },
    "C_capability_conflict": {
      "severity": "medium",
      "rationale": "Chatwoot has broad network egress and API integrations, and gpt-researcher can read files, spawn subprocesses, and run browsers. Both can operate on shared artifacts or external services, so conflicting writes or duplicated actions are plausible. There is no documented locking or coordination between the pair, but the overlap is not inherently destructive.",
      "citations": [
        {
          "profile_field": "agent_a.capabilities.network_egress"
        },
        {
          "profile_field": "agent_a.io_surfaces.calls_apis"
        },
        {
          "profile_field": "agent_b.capabilities.read_filesystem"
        },
        {
          "profile_field": "agent_b.capabilities.spawn_subprocesses"
        },
        {
          "profile_field": "agent_b.concurrency_model.supports_multiple_instances"
        }
      ],
      "conditions": [
        "IF both agents write to the same shared workspace or ticket queue",
        "IF both agents act on the same external integration without locking"
      ],
      "mitigations": [
        "Assign separate workspaces per agent",
        "Serialize writes through one orchestrator",
        "Disable one agent's write path for shared resources",
        "Use file locks or queue locks",
        "requires-engineering: add optimistic concurrency checks"
      ]
    },
    "D_cascading_error": {
      "severity": "medium",
      "rationale": "Chatwoot produces customer-facing support content, and gpt-researcher is built around planner/execution/publisher flows that can turn inputs into reports. If Chatwoot output is treated as authoritative research input, gpt-researcher may amplify errors or hallucinations into polished reports. The pair has no built-in verification link in the profiles.",
      "citations": [
        {
          "profile_field": "agent_a.category"
        },
        {
          "profile_field": "agent_a.data_classes_touched"
        },
        {
          "profile_field": "agent_b.category"
        },
        {
          "profile_field": "agent_b.sandboxing.subagent_model"
        },
        {
          "profile_field": "agent_b.sandboxing.tool_use_pattern"
        }
      ],
      "conditions": [
        "IF Chatwoot summaries are fed directly into gpt-researcher reports",
        "IF gpt-researcher publishes outputs without human verification"
      ],
      "mitigations": [
        "Require source citations for every claim",
        "Compare outputs against original tickets before publishing",
        "Insert a human approval gate",
        "Limit Chatwoot-derived inputs to summaries only",
        "requires-engineering: add automated fact-checking"
      ]
    },
    "E_compliance": {
      "severity": "high",
      "rationale": "Chatwoot handles customer data and orders, while gpt-researcher explicitly uses third-party APIs and handles secrets for OpenAI, Tavily, LangChain, Google, and GitHub. If regulated customer data or EU PII is routed through gpt-researcher, the pair can create residency and retention mismatches. The profiles do not show a DPA or residency guardrail, so the safer severity is high.",
      "citations": [
        {
          "profile_field": "agent_a.data_classes_touched"
        },
        {
          "profile_field": "agent_b.permissions_requested.secrets_handled"
        },
        {
          "profile_field": "agent_b.io_surfaces.calls_apis"
        },
        {
          "profile_field": "agent_b.vendor.url"
        }
      ],
      "conditions": [
        "IF customer data includes regulated personal data or EU PII",
        "IF gpt-researcher sends that data to non-approved third-party APIs"
      ],
      "mitigations": [
        "Block regulated data from the research workflow",
        "Use region-approved providers only",
        "Log and review all outbound destinations",
        "Set short retention on exported artifacts",
        "requires-engineering: add residency and DPA enforcement"
      ]
    }
  },
  "framework_mappings": {
    "nist_ai_rmf": [
      "MAP-1.1",
      "MEASURE-2.7",
      "MANAGE-1.2"
    ],
    "iso_42001": [
      "8.2",
      "8.3",
      "10.2"
    ]
  },
  "reproducibility": {
    "rubric_url": "/_meta/rubric/1.0.json",
    "profile_a_hash": "sha256:c5a0376144c4d3db5ad64591f492d233bf5a1e5321e8f41421d3fcf7cac135d0",
    "profile_b_hash": "sha256:05dfd3fdafbdb03d8f74a7d18a0fd3873b8320ac2b3b0cb120f971e05a2a7b8c",
    "evidence_bundle_hash": "sha256:44136fa355b3678a1146ad16f7e8649e94fb4fc21fe77e8310c060f61caaff8a"
  }
}
