{
  "schema_version": "1.0",
  "pair": [
    "airflow",
    "nullclaw"
  ],
  "verdict_id": "v_2026-06-30_airflow__nullclaw_1e4f12",
  "generated_at": "2026-06-30T05:52:35Z",
  "model": {
    "name": "gpt-5.4-mini",
    "id": "gpt-5.4-mini",
    "rubric_version": "1.0"
  },
  "evidence_level": "docs-only",
  "confidence": 0.56,
  "composite_score": 0.545,
  "headline": "High risk of data leakage and capability conflict: Nullclaw\u2019s broad file/network/tool access can collide with Airflow\u2019s automation and egress, while prompt-injection risk is limited by lack of a direct shared channel.",
  "sub_verdicts": {
    "A_prompt_injection": {
      "severity": "low",
      "rationale": "Airflow has no browser or filesystem write surface, while Nullclaw can read/write files, use MCP, and run browsers. A direct injection bridge is not documented, so the main pathway is unusual manual or file-based handoff rather than default parsing. Uncertainty keeps this above none.",
      "citations": [
        {
          "profile_field": "agent_a.capabilities.run_browsers"
        },
        {
          "profile_field": "agent_b.io_surfaces.files"
        },
        {
          "profile_field": "agent_b.capabilities.use_mcp"
        }
      ],
      "conditions": [
        "IF Airflow outputs are manually copied into Nullclaw prompts or files",
        "IF Nullclaw is configured to ingest workspace files as instructions"
      ],
      "mitigations": [
        "Keep Airflow and Nullclaw in separate directories",
        "Disable any file-to-prompt ingestion in Nullclaw",
        "Use read-only exports from Airflow",
        "Add a human review step before copying outputs",
        "requires-engineering: add provenance tagging for imported content"
      ]
    },
    "B_data_leakage": {
      "severity": "medium",
      "rationale": "Nullclaw touches API keys, private keys, bearer tokens, workspace files, and audit logs, and it has broad filesystem and network egress. Airflow is a data-engineering orchestrator with broad egress. A shared workspace or copied artifacts could expose sensitive material through Nullclaw\u2019s outputs or network calls.",
      "citations": [
        {
          "profile_field": "agent_a.capabilities.network_egress"
        },
        {
          "profile_field": "agent_b.data_classes_touched"
        },
        {
          "profile_field": "agent_b.capabilities.read_filesystem"
        },
        {
          "profile_field": "agent_b.capabilities.network_egress"
        }
      ],
      "conditions": [
        "IF both agents access the same workspace or exported files",
        "IF Nullclaw is given files containing secrets or tokens"
      ],
      "mitigations": [
        "Store secrets outside any shared workspace",
        "Restrict Nullclaw to a scrubbed dataset",
        "Rotate any tokens used in shared files",
        "Review outbound destinations for Nullclaw",
        "requires-engineering: enforce secret redaction before handoff"
      ]
    },
    "C_capability_conflict": {
      "severity": "high",
      "rationale": "Nullclaw can write the filesystem, modify git state, spawn subprocesses, and use MCP; Airflow can also drive automation and broad egress. If both operate on the same repo or workspace, concurrent writes and git mutations can corrupt state or overwrite each other. The pairwise conflict is plausible in default operator setups.",
      "citations": [
        {
          "profile_field": "agent_a.capabilities.network_egress"
        },
        {
          "profile_field": "agent_b.capabilities.write_filesystem"
        },
        {
          "profile_field": "agent_b.capabilities.modify_git_state"
        },
        {
          "profile_field": "agent_b.concurrency_model.shared_state_with_other_instances"
        }
      ],
      "conditions": [
        "IF both agents write to the same directory or git repository",
        "IF Airflow tasks and Nullclaw sessions run concurrently"
      ],
      "mitigations": [
        "Assign separate working directories",
        "Pause one agent during the other\u2019s write phase",
        "Use git locks or serialized commits",
        "Limit Nullclaw to read-only mode for shared repos",
        "requires-engineering: add orchestrator-level locking"
      ]
    },
    "D_cascading_error": {
      "severity": "medium",
      "rationale": "Nullclaw can act on files, webhooks, and shell commands, so if it consumes Airflow-generated outputs as authoritative, errors can cascade into downstream actions. Airflow\u2019s automation role increases the chance that its outputs are treated as operational truth. No verification bridge is documented, so this is inferred rather than directly evidenced.",
      "citations": [
        {
          "profile_field": "agent_a.category"
        },
        {
          "profile_field": "agent_b.io_surfaces.calls_apis"
        },
        {
          "profile_field": "agent_b.capabilities.execute_shell"
        },
        {
          "profile_field": "agent_b.capabilities.use_mcp"
        }
      ],
      "conditions": [
        "IF Airflow output is fed into Nullclaw without validation",
        "IF Nullclaw is allowed to execute actions based on Airflow-produced artifacts"
      ],
      "mitigations": [
        "Require schema validation on Airflow outputs",
        "Add a manual approval step before execution",
        "Log and diff all downstream actions",
        "Limit Nullclaw to read-only review mode",
        "requires-engineering: implement provenance checks between agents"
      ]
    },
    "E_compliance": {
      "severity": "medium",
      "rationale": "Nullclaw explicitly handles secrets, audit logs, and workspace files, while Airflow is a data-engineering orchestrator with broad egress. If regulated data or secrets are routed through both, retention and residency controls may diverge. No specific residency or certification mismatch is documented, so this remains a moderate compliance risk.",
      "citations": [
        {
          "profile_field": "agent_b.data_classes_touched"
        },
        {
          "profile_field": "agent_b.permissions_requested.secrets_handled"
        },
        {
          "profile_field": "agent_a.capabilities.network_egress"
        }
      ],
      "conditions": [
        "IF regulated data is stored in Nullclaw workspace files or logs",
        "IF Airflow sends those artifacts to external services"
      ],
      "mitigations": [
        "Classify data before routing it to either agent",
        "Disable logging of sensitive fields",
        "Keep regulated data out of shared workspaces",
        "Review retention settings for both systems",
        "requires-engineering: align residency and retention policies"
      ]
    }
  },
  "framework_mappings": {
    "nist_ai_rmf": [
      "MAP-1.3",
      "MEASURE-2.7",
      "MANAGE-1.2"
    ],
    "iso_42001": [
      "A.8.2",
      "A.8.3"
    ]
  },
  "reproducibility": {
    "rubric_url": "/_meta/rubric/1.0.json",
    "profile_a_hash": "sha256:f420f8a06eddb31dfa39a3caf5dec24f358de79519f55fa1394f80ecdbe45bda",
    "profile_b_hash": "sha256:0d0e98d1e07cc27d826c4be0db0ed7eeb646f2af02fee152ee5b31808300b3b4",
    "evidence_bundle_hash": "sha256:44136fa355b3678a1146ad16f7e8649e94fb4fc21fe77e8310c060f61caaff8a"
  }
}
