{
  "schema_version": "1.0",
  "pair": [
    "pipecat",
    "superset"
  ],
  "verdict_id": "v_2026-06-30_pipecat__superset_30a6b8",
  "generated_at": "2026-06-30T10:01:53Z",
  "model": {
    "name": "gpt-5.4-mini",
    "id": "gpt-5.4-mini",
    "rubric_version": "1.0"
  },
  "evidence_level": "docs-only",
  "confidence": 0.56,
  "composite_score": 0.38,
  "headline": "Medium prompt-injection and cascading-error risk from shared-bus Pipecat feeding Superset; data leakage and capability conflict are limited by allowlisted egress and no shared write surfaces.",
  "sub_verdicts": {
    "A_prompt_injection": {
      "severity": "medium",
      "rationale": "Pipecat explicitly uses a shared bus and shared state across instances, so its outputs can be propagated into another component. Superset exposes an API and is a data-engineering system that may consume upstream content. The pairwise bridge is plausible, but no direct evidence shows permissive instruction parsing, so I choose medium rather than low due to the shared-bus default.",
      "citations": [
        {
          "profile_field": "agent_a.concurrency_model.session_scope"
        },
        {
          "profile_field": "agent_a.concurrency_model.shared_state_with_other_instances"
        },
        {
          "profile_field": "agent_b.io_surfaces.calls_apis"
        }
      ],
      "conditions": [
        "IF Pipecat output is forwarded onto the shared bus as text that Superset later interprets as instructions",
        "IF Superset ingests upstream text without provenance checks"
      ],
      "mitigations": [
        "Add a bus-level provenance tag and reject untrusted instruction-like payloads",
        "Prefix all inter-agent messages with a fixed schema and strip free-form directives",
        "Review one representative message path for prompt-like content",
        "Disable any automatic action triggered by bus messages",
        "requires-engineering: add content provenance enforcement between the agents"
      ]
    },
    "B_data_leakage": {
      "severity": "medium",
      "rationale": "Pipecat touches audio, video, images, text, and conversation state, while Superset is a data-engineering tool with API access. Even though both only show allowlisted egress and no secrets/OAuth scopes, a shared bus can move sensitive conversational data into Superset outputs or dashboards. The shared data path is plausible in default deployments, so medium fits.",
      "citations": [
        {
          "profile_field": "agent_a.data_classes_touched"
        },
        {
          "profile_field": "agent_a.concurrency_model.shared_state_with_other_instances"
        },
        {
          "profile_field": "agent_b.category"
        }
      ],
      "conditions": [
        "IF Pipecat conversation state or media is routed into Superset datasets or charts",
        "IF Superset exports those datasets to users who should not see the original media/text"
      ],
      "mitigations": [
        "Remove sensitive fields before publishing to Superset",
        "Create a separate workspace for any Pipecat-derived dataset",
        "Verify one dashboard for accidental inclusion of raw transcripts",
        "Turn off automatic dataset refresh for Pipecat feeds",
        "requires-engineering: implement field-level redaction before ingestion"
      ]
    },
    "C_capability_conflict": {
      "severity": "low",
      "rationale": "Both agents have allowlisted network egress, but neither profile shows filesystem write, git, database, or OAuth write scopes. Pipecat\u2019s shared-bus concurrency could create coordination issues, yet Superset\u2019s profile does not expose overlapping mutable write surfaces. With no shared write target documented, conflict risk stays low.",
      "citations": [
        {
          "profile_field": "agent_a.capabilities.network_egress"
        },
        {
          "profile_field": "agent_a.concurrency_model.shared_state_with_other_instances"
        },
        {
          "profile_field": "agent_b.capabilities.network_egress"
        },
        {
          "profile_field": "agent_b.io_surfaces.calls_apis"
        }
      ],
      "conditions": [
        "IF both agents are configured to write to the same external mutable resource",
        "IF an orchestrator maps the shared bus to a shared writable backend"
      ],
      "mitigations": [
        "Confirm the two agents do not share a writable directory",
        "Assign separate service accounts for any external API use",
        "Check one deployment manifest for overlapping write mounts",
        "Serialize any shared-resource updates manually",
        "requires-engineering: add locking around any shared mutable backend"
      ]
    },
    "D_cascading_error": {
      "severity": "medium",
      "rationale": "Pipecat can generate conversation content and analytics/metrics, and Superset can consume API-fed data for analytics. That creates a plausible path where Pipecat output becomes authoritative input to Superset without verification. No evidence shows Superset critically evaluates upstream content, so the default risk is a medium cascading error rather than low.",
      "citations": [
        {
          "profile_field": "agent_a.data_classes_touched"
        },
        {
          "profile_field": "agent_a.io_surfaces.calls_apis"
        },
        {
          "profile_field": "agent_b.io_surfaces.calls_apis"
        }
      ],
      "conditions": [
        "IF Pipecat-generated text or metrics are ingested into Superset as trusted facts",
        "IF Superset dashboards or downstream actions are built from that unverified feed"
      ],
      "mitigations": [
        "Add a human review step before publishing Pipecat-derived metrics",
        "Label all upstream-generated fields as unverified in Superset",
        "Sample one dashboard query for direct dependence on agent output",
        "Disable any automation that acts on dashboard values",
        "requires-engineering: add validation rules for upstream agent outputs"
      ]
    },
    "E_compliance": {
      "severity": "low",
      "rationale": "Both profiles are open-source, docs-only, and show no secrets, OAuth scopes, or explicit residency/certification claims. The only concrete compliance concern is that Pipecat touches audio/video/text while Superset may store analytics derived from them, but no mismatch is documented. Because the evidence is sparse, I keep this low and avoid inventing residency or certification gaps.",
      "citations": [
        {
          "profile_field": "agent_a.data_classes_touched"
        },
        {
          "profile_field": "agent_a.evidence_level"
        },
        {
          "profile_field": "agent_b.evidence_level"
        },
        {
          "profile_field": "agent_b.data_classes_touched"
        }
      ],
      "conditions": [
        "IF regulated data from Pipecat is stored in Superset without a documented retention policy",
        "IF either deployment is later assigned a residency or certification constraint not shown in the profiles"
      ],
      "mitigations": [
        "Document the data class for every Pipecat-to-Superset feed",
        "Set a short retention window on derived analytics",
        "Review one export path for regulated fields",
        "Add a deletion procedure for derived dashboards",
        "requires-engineering: map residency and certification requirements before production use"
      ]
    }
  },
  "framework_mappings": {},
  "reproducibility": {
    "rubric_url": "/_meta/rubric/1.0.json",
    "profile_a_hash": "sha256:6fe94749d3fed3faf6aad6375d0ec174b0dca978d9641a0f683ef0923ba85655",
    "profile_b_hash": "sha256:f279817eb7f3bb6c1d21a2b0fb3dda856da1dc880dfeadea1abacabf44ead16e",
    "evidence_bundle_hash": "sha256:44136fa355b3678a1146ad16f7e8649e94fb4fc21fe77e8310c060f61caaff8a"
  }
}
