{
  "schema_version": "1.0",
  "pair": [
    "chatwoot",
    "superset"
  ],
  "verdict_id": "v_2026-06-27_chatwoot__superset_937754",
  "generated_at": "2026-06-27T03:13:31Z",
  "model": {
    "name": "gpt-5.4-mini",
    "id": "gpt-5.4-mini",
    "rubric_version": "1.0"
  },
  "evidence_level": "docs-only",
  "confidence": 0.52,
  "composite_score": 0.395,
  "headline": "Medium risk: shared-support-to-analytics workflows can leak customer data and create output-driven errors; prompt-injection and capability conflict are lower but nonzero.",
  "sub_verdicts": {
    "A_prompt_injection": {
      "severity": "low",
      "rationale": "Chatwoot can ingest external messages and integrations, while Superset primarily consumes dashboards and API data. No shared channel is documented, so direct injection is not proven. The plausible bridge is manual copy/paste or exported content, which keeps blast radius limited.",
      "citations": [
        {
          "profile_field": "agent_a.io_surfaces.calls_apis"
        },
        {
          "profile_field": "agent_b.io_surfaces.calls_apis"
        }
      ],
      "conditions": [
        "IF Chatwoot output is manually pasted into Superset SQL, markdown, or notes fields",
        "IF either agent is configured to parse untrusted text as instructions"
      ],
      "mitigations": [
        "Disable copy-paste of raw agent output into operational fields",
        "Use a fixed template for any transferred text",
        "Add a human review step before importing content",
        "Restrict Superset text inputs to non-executable formats",
        "requires-engineering: add provenance labels to transferred content"
      ]
    },
    "B_data_leakage": {
      "severity": "medium",
      "rationale": "Chatwoot touches customer data, contact profiles, interaction history, orders, and messages, while Superset is an analytics system that can surface imported data. Even without a documented shared workspace, moving support data into analytics can expose sensitive records. The pairwise leakage path is plausible in default business workflows.",
      "citations": [
        {
          "profile_field": "agent_a.data_classes_touched"
        },
        {
          "profile_field": "agent_b.category"
        },
        {
          "profile_field": "agent_a.capabilities.network_egress"
        },
        {
          "profile_field": "agent_b.capabilities.network_egress"
        }
      ],
      "conditions": [
        "IF customer-support records are exported from Chatwoot into Superset datasets",
        "IF Superset dashboards are shared beyond the support team"
      ],
      "mitigations": [
        "Limit Superset datasets to de-identified fields",
        "Review dashboard permissions before publishing",
        "Exclude messages and contact profiles from exports",
        "Rotate or redact identifiers in support extracts",
        "requires-engineering: enforce row-level security and data-loss controls"
      ]
    },
    "C_capability_conflict": {
      "severity": "low",
      "rationale": "Chatwoot has broad network egress and Superset has allowlisted egress, but neither profile shows filesystem write, git mutation, or shared mutable resources. That makes direct write-write conflict unlikely. The remaining overlap is operational rather than destructive, so severity stays low.",
      "citations": [
        {
          "profile_field": "agent_a.capabilities.network_egress"
        },
        {
          "profile_field": "agent_b.capabilities.network_egress"
        },
        {
          "profile_field": "agent_a.permissions_requested.elevated_privileges"
        },
        {
          "profile_field": "agent_b.permissions_requested.elevated_privileges"
        }
      ],
      "conditions": [
        "IF both agents are later granted write access to the same external system",
        "IF an orchestrator maps both to the same mutable OAuth resource"
      ],
      "mitigations": [
        "Keep each agent on separate credentials",
        "Avoid shared write targets",
        "Document ownership for each external system",
        "Use read-only exports where possible",
        "requires-engineering: add locking for any shared mutable backend"
      ]
    },
    "D_cascading_error": {
      "severity": "medium",
      "rationale": "Chatwoot can produce customer-facing content and reports, and Superset can present that output as analytics. If Superset treats imported support summaries as authoritative, errors can cascade into misleading dashboards or decisions. No verification step is documented, so the interaction is plausible in default reporting workflows.",
      "citations": [
        {
          "profile_field": "agent_a.data_classes_touched"
        },
        {
          "profile_field": "agent_b.category"
        },
        {
          "profile_field": "agent_b.io_surfaces.calls_apis"
        }
      ],
      "conditions": [
        "IF Chatwoot-generated summaries are imported into Superset without validation",
        "IF Superset dashboards are used for operational decisions"
      ],
      "mitigations": [
        "Mark imported fields as unverified",
        "Require source links on every summary row",
        "Sample-check a few records before publishing",
        "Separate raw support data from derived metrics",
        "requires-engineering: add validation and lineage checks"
      ]
    },
    "E_compliance": {
      "severity": "medium",
      "rationale": "Chatwoot clearly handles customer data and messages, while Superset is an analytics platform with no stated residency, retention, or certification controls. That creates a compliance mismatch risk when support data is moved into analytics. Because the profiles do not document a specific jurisdictional breach, medium is the highest supportable severity.",
      "citations": [
        {
          "profile_field": "agent_a.data_classes_touched"
        },
        {
          "profile_field": "agent_b.docs_urls"
        },
        {
          "profile_field": "agent_a.evidence_level"
        },
        {
          "profile_field": "agent_b.evidence_level"
        }
      ],
      "conditions": [
        "IF customer data from Chatwoot is loaded into Superset outside the approved retention policy",
        "IF analytics access is broader than support-system access"
      ],
      "mitigations": [
        "Confirm retention settings for exported datasets",
        "Restrict analytics access to approved roles",
        "Remove direct identifiers before export",
        "Record a data-processing purpose for each dashboard",
        "requires-engineering: align residency and retention controls"
      ]
    }
  },
  "framework_mappings": {},
  "reproducibility": {
    "rubric_url": "/_meta/rubric/1.0.json",
    "profile_a_hash": "sha256:c5a0376144c4d3db5ad64591f492d233bf5a1e5321e8f41421d3fcf7cac135d0",
    "profile_b_hash": "sha256:f279817eb7f3bb6c1d21a2b0fb3dda856da1dc880dfeadea1abacabf44ead16e",
    "evidence_bundle_hash": "sha256:44136fa355b3678a1146ad16f7e8649e94fb4fc21fe77e8310c060f61caaff8a"
  }
}
